{
  "scenario_id": "scenario_01_ldpreload_cleanup",
  "run_id": "ubuntu-22.04_scenario_01_ldpreload_cleanup_calibration",
  "distro": "ubuntu-22.04",
  "cleanup": true,
  "random_seed": 1337,
  "timezone": "UTC",
  "events": [
    {
      "gt_id": "G1",
      "ts_utc": "2026-06-13T12:00:00.000Z",
      "technique": "T1082",
      "event_class": "file_created",
      "entity": {
        "type": "path",
        "value": "/tmp/T1082.txt"
      },
      "details": {
        "step": "E1_discovery_os_info"
      },
      "expected_sources": [
        "disk_fs"
      ],
      "observables": [
        {
          "operation": "timeline",
          "source_tool": "tsk",
          "entity_type": "path",
          "entity_value": "/tmp/T1082.txt"
        }
      ]
    },
    {
      "gt_id": "G2",
      "ts_utc": "2026-06-13T12:00:05.000Z",
      "technique": "T1574.006",
      "event_class": "persistence_installed",
      "entity": {
        "type": "path",
        "value": "/etc/ld.so.preload"
      },
      "details": {
        "step": "E2_ldpreload_persistence"
      },
      "expected_sources": [
        "disk_fs",
        "disk_logs"
      ],
      "observables": [
        {
          "operation": "timeline",
          "source_tool": "tsk",
          "entity_type": "path",
          "entity_value": "/etc/ld.so.preload"
        },
        {
          "operation": "timeline",
          "source_tool": "plaso",
          "entity_type": "process",
          "entity_value": "sudo sh -c 'echo /tmp/T1574006.so > /etc/ld.so.preload'"
        },
        {
          "operation": "timeline",
          "source_tool": "plaso_sigma",
          "entity_type": "path",
          "entity_value": "/etc/ld.so.preload"
        }
      ]
    },
    {
      "gt_id": "G3",
      "ts_utc": "2026-06-13T12:00:06.000Z",
      "technique": "T1574.006",
      "event_class": "file_created",
      "entity": {
        "type": "path",
        "value": "/tmp/T1574006.so"
      },
      "details": {
        "step": "E2_ldpreload_payload"
      },
      "expected_sources": [
        "disk_fs",
        "memory"
      ],
      "observables": [
        {
          "operation": "timeline",
          "source_tool": "tsk",
          "entity_type": "path",
          "entity_value": "/tmp/T1574006.so"
        }
      ]
    },
    {
      "gt_id": "G4",
      "ts_utc": "2026-06-13T12:00:08.000Z",
      "technique": "T1574.006",
      "event_class": "process_exec",
      "entity": {
        "type": "path",
        "value": "/tmp/T1574006.so"
      },
      "details": {
        "step": "E3_ldpreload_triggered"
      },
      "expected_sources": [
        "memory"
      ],
      "observables": [
        {
          "operation": "memory_analysis",
          "source_tool": "vol3",
          "entity_type": "path",
          "entity_value": "/tmp/T1574006.so"
        }
      ]
    },
    {
      "gt_id": "G5",
      "ts_utc": "2026-06-13T12:00:10.000Z",
      "technique": "T1059.004",
      "event_class": "network_connection",
      "entity": {
        "type": "socket",
        "value": "192.168.100.1:4444"
      },
      "details": {
        "step": "E4_reverse_shell"
      },
      "expected_sources": [
        "memory"
      ],
      "observables": [
        {
          "operation": "memory_analysis",
          "source_tool": "vol3",
          "entity_type": "socket",
          "entity_value": "192.168.100.1:4444"
        }
      ]
    },
    {
      "gt_id": "G6",
      "ts_utc": "2026-06-13T12:00:12.000Z",
      "technique": "T1059.004",
      "event_class": "file_created",
      "entity": {
        "type": "path",
        "value": "/tmp/.rs_fifo"
      },
      "details": {
        "step": "E4_reverse_shell_fifo"
      },
      "expected_sources": [
        "disk_fs"
      ],
      "observables": [
        {
          "operation": "timeline",
          "source_tool": "tsk",
          "entity_type": "path",
          "entity_value": "/tmp/.rs_fifo"
        }
      ]
    }
  ]
}
